{
  "schema_version": "behavior-analysis-v1",
  "dog_visible": false,
  "dogs_detected": 0,
  "observation_quality": 0.8,
  "body_visibility": 0.0,
  "face_visibility": 0.0,
  "activity": { "label": "unknown", "confidence": 0.99 },
  "state": { "label": "indeterminate", "confidence": 0.99 },
  "state_scores": {
    "relaxed": 0.0,
    "engaged": 0.0,
    "alert": 0.0,
    "stress_signals": 0.0,
    "indeterminate": 0.99
  },
  "signals": [],
  "summary": "No dog is visible in the sequence.",
  "limitations": ["No dog visible"]
}
